user_input,retrieved_contexts,response,reference,faithfulness,llm_context_precision_without_reference,context_recall
What are common adverse reactions to metoprolol?,"['[metoprolol — adverse_reactions] red in about 5% of patients. Photosensitivity and worsening of psoriasis has been reported. Miscellaneous: Peyronie’s disease, musculoskeletal pain, blurred vision, and tinnitus has been reported. Myocardial Infarction In general, the adverse reactions observed in trials with metoprolol in MI are consistent with the hypertension and angina experience. In a randomized comparison of metoprolol and placebo in the setting of acute MI the following adverse reactions were reported: Metoprolol Placebo Hypotension (systolic BP < 90 mm Hg) 27.4% 23.2% Bradycardia (heart rate < 40 beats/min) 15.9% 6.7% Second- or third-degree heart block 4.7% 4.7% First-degree heart block (P-R ≥ 0.26 sec) 5.3% 1.9% Heart failure 27.5% 29.6% 6.2 Post-Marketing Experience The following adverse reactions have been iden', '[metoprolol — adverse_reactions] red in about 5% of patients. Photosensitivity and worsening of psoriasis has been reported. Miscellaneous: Peyronie’s disease, musculoskeletal pain, blurred vision, and tinnitus has been reported. Myocardial Infarction In general, the adverse reactions observed in trials with metoprolol in MI are consistent with the hypertension and angina experience. In a randomized comparison of metoprolol and placebo in the setting of acute MI the following adverse reactions were reported: Metoprolol Placebo Hypotension (systolic BP < 90 mm Hg) 27.4% 23.2% Bradycardia (heart rate < 40 beats/min) 15.9% 6.7% Second- or third-degree heart block 4.7% 4.7% First-degree heart block (P-R ≥ 0.26 sec) 5.3% 1.9% Heart failure 27.5% 29.6% 6.2 Post-Marketing Experience The following adverse reactions have been iden', '[metoprolol — adverse_reactions] art failure 27.5% 29.6% 6.2 Post-Marketing Experience The following adverse reactions have been identified during post approval use of metoprolol. Because these reactions are reported voluntarily from a population of uncertain size, it is not always possible to reliably estimate their frequency or establish a causal relationship to drug exposure. Central Nervous System: Reversible mental depression progressing to catatonia; an acute reversible syndrome characterized by disorientation for time and place, short-term memory loss, emotional lability, slightly clouded sensorium, and decreased performance on neuropsychometrics. Cardiovascular: Intensification of AV block [see Contraindications (4) ]. Hematologic: Agranulocytosis, nonthrombocytopenic purpura and thrombocytopenic purpura. Hypersen', '[metoprolol — adverse_reactions] art failure 27.5% 29.6% 6.2 Post-Marketing Experience The following adverse reactions have been identified during post approval use of metoprolol. Because these reactions are reported voluntarily from a population of uncertain size, it is not always possible to reliably estimate their frequency or establish a causal relationship to drug exposure. Central Nervous System: Reversible mental depression progressing to catatonia; an acute reversible syndrome characterized by disorientation for time and place, short-term memory loss, emotional lability, slightly clouded sensorium, and decreased performance on neuropsychometrics. Cardiovascular: Intensification of AV block [see Contraindications (4) ]. Hematologic: Agranulocytosis, nonthrombocytopenic purpura and thrombocytopenic purpura. Hypersen', '[metoprolol — adverse_reactions] 6 ADVERSE REACTIONS The following adverse reactions are described elsewhere in labeling: Worsening angina or myocardial infarction [see Warnings and Precautions (5) ] Worsening heart failure [see Warnings and Precautions (5) ]. Worsening AV block [see Contraindications (4) ]. \xadMost common adverse reactions: tiredness, dizziness, depression, shortness of breath, bradycardia, hypotension, diarrhea, pruritus, rash. ( 6.1 ) To report SUSPECTED ADVERSE REACTIONS, contact Rising Pharma Holdings, Inc. at 1-844-874-7464 or FDA at 1-800-FDA-1088 or www.fda.gov/medwatch. 6.1 Clinical Trials Experience Because clinical trials are conducted under widely varying conditions, adverse reaction rates observed in the clinical trials of a drug cannot be directly compared to rates in the clinical trials of an']","Common adverse reactions to metoprolol include tiredness, dizziness, depression, shortness of breath, bradycardia, hypotension, diarrhea, pruritus, and rash [metoprolol — adverse_reactions].","Tiredness, dizziness, depression, bradycardia, shortness of breath, and hypotension.",1.0,0.99999999998,1.0
What is atorvastatin used for?,"['[atorvastatin — indications_and_usage] 1 INDICATIONS AND USAGE Atorvastatin calcium tablets are indicated: To reduce the risk of: Myocardial infarction (MI), stroke, revascularization procedures, and angina in adults with multiple risk factors for coronary heart disease (CHD) but without clinically evident CHD MI and stroke in adults with type 2 diabetes mellitus with multiple risk factors for CHD but without clinically evident CHD Non-fatal MI, fatal and non-fatal stroke, revascularization procedures, hospitalization for congestive heart failure, and angina in adults with clinically evident CHD As an adjunct to diet to reduce low-density lipoprotein cholesterol (LDL-C) in: Adults with primary hyperlipidemia. Adults and pediatric patients aged 10 years and older with heterozygous familial hypercholesterolemia (HeFH). As an adju', '[atorvastatin — indications_and_usage] 1 INDICATIONS AND USAGE Atorvastatin calcium tablets are indicated: To reduce the risk of: Myocardial infarction (MI), stroke, revascularization procedures, and angina in adults with multiple risk factors for coronary heart disease (CHD) but without clinically evident CHD MI and stroke in adults with type 2 diabetes mellitus with multiple risk factors for CHD but without clinically evident CHD Non-fatal MI, fatal and non-fatal stroke, revascularization procedures, hospitalization for congestive heart failure, and angina in adults with clinically evident CHD As an adjunct to diet to reduce low-density lipoprotein cholesterol (LDL-C) in: Adults with primary hyperlipidemia. Adults and pediatric patients aged 10 years and older with heterozygous familial hypercholesterolemia (HeFH). As an adju', '[atorvastatin — adverse_reactions] ts with HeFH In a 26-week controlled study in pediatric patients with HeFH (ages 10 years to 17 years) (n=140, 31% female; 92% White, 1.6% Blacks, 1.6% Asians, 4.8% other), the safety and tolerability profile of atorvastatin calcium 10 to 20 mg daily, as an adjunct to diet to reduce total cholesterol, LDL-C, and apo B levels, was generally similar to that of placebo [see Use in Specific Populations (8.4) and Clinical Studies (14.6)]. 6.2 Postmarketing Experience The following adverse reactions have been identified during post-approval use of atorvastatin calcium. Because these reactions are reported voluntarily from a population of uncertain size, it is not always possible to reliably estimate their frequency or establish a causal relationship to drug exposure. Gastrointestinal disorders: ', '[atorvastatin — adverse_reactions] ts with HeFH In a 26-week controlled study in pediatric patients with HeFH (ages 10 years to 17 years) (n=140, 31% female; 92% White, 1.6% Blacks, 1.6% Asians, 4.8% other), the safety and tolerability profile of atorvastatin calcium 10 to 20 mg daily, as an adjunct to diet to reduce total cholesterol, LDL-C, and apo B levels, was generally similar to that of placebo [see Use in Specific Populations (8.4) and Clinical Studies (14.6)]. 6.2 Postmarketing Experience The following adverse reactions have been identified during post-approval use of atorvastatin calcium. Because these reactions are reported voluntarily from a population of uncertain size, it is not always possible to reliably estimate their frequency or establish a causal relationship to drug exposure. Gastrointestinal disorders: ', '[atorvastatin — drug_interactions] ology (12.3) ]. Cases of myopathy and rhabdomyolysis have been reported with concomitant use of ledipasvir plus sofosbuvir with atorvastatin. Intervention: Concomitant use of tipranavir plus ritonavir or glecaprevir plus pibrentasvir with atorvastatin is not recommended. In patients taking lopinavir plus ritonavir, or simeprevir, consider the risk/benefit of concomitant use with atorvastatin. In patients taking saquinavir plus ritonavir, darunavir plus ritonavir, fosamprenavir, fosamprenavir plus ritonavir, elbasvir plus grazoprevir or letermovir, do not exceed atorvastatin 20 mg. In patients taking nelfinavir, do not exceed atorvastatin 40 mg [see Dosage and Administration (2.5) ]. Consider the risk/benefit of concomitant use of ledipasvir plus sofosbuvir with atorvastatin. Monitor all pa']","Atorvastatin calcium tablets are indicated to reduce the risk of myocardial infarction (MI), stroke, revascularization procedures, and angina in adults with multiple risk factors for coronary heart disease (CHD) but without clinically evident CHD. It is also indicated for MI and stroke in adults with type 2 diabetes mellitus with multiple risk factors for CHD but without clinically evident CHD, as well as for non-fatal MI, fatal and non-fatal stroke, revascularization procedures, hospitalization for congestive heart failure, and angina in adults with clinically evident CHD. Additionally, it is used as an adjunct to diet to reduce low-density lipoprotein cholesterol (LDL-C) in adults with primary hyperlipidemia and in adults and pediatric patients aged 10 years and older with heterozygous familial hypercholesterolemia (HeFH) [atorvastatin — indications_and_usage].",To reduce risk of MI and stroke and to lower LDL cholesterol in patients with CHD risk factors.,1.0,0.99999999995,1.0
Which drugs interact with warfarin?,"['[warfarin — drug_interactions] abolism (hereditary resistance). Pharmacokinetic mechanisms for drug interactions with warfarin sodium are mainly enzyme induction, enzyme inhibition, and reduced plasma protein binding. It is important to note that some drugs may interact by more than one mechanism. More frequent INR monitoring should be performed when starting or stopping other drugs, including botanicals, or when changing dosages of other drugs, including drugs intended for short-term use (e.g., antibiotics, antifungals, corticosteroids) [ see Boxed Warning ]. Consult the labeling of all concurrently used drugs to obtain further information about interactions with warfarin sodium or adverse reactions pertaining to bleeding. 7.2 CYP450 Interactions CYP450 isozymes involved in the metabolism of warfarin include CYP2C9, 2C', '[warfarin — drug_interactions] abolism (hereditary resistance). Pharmacokinetic mechanisms for drug interactions with warfarin sodium are mainly enzyme induction, enzyme inhibition, and reduced plasma protein binding. It is important to note that some drugs may interact by more than one mechanism. More frequent INR monitoring should be performed when starting or stopping other drugs, including botanicals, or when changing dosages of other drugs, including drugs intended for short-term use (e.g., antibiotics, antifungals, corticosteroids) [ see Boxed Warning ]. Consult the labeling of all concurrently used drugs to obtain further information about interactions with warfarin sodium or adverse reactions pertaining to bleeding. 7.2 CYP450 Interactions CYP450 isozymes involved in the metabolism of warfarin include CYP2C9, 2C', '[warfarin — drug_interactions] 7 DRUG INTERACTIONS Concomitant use of drugs that increase bleeding risk, antibiotics, antifungals, botanical (herbal) products, and inhibitors and inducers of CYP2C9, 1A2, or 3A4. ( 7 ) Consult labeling of all concurrently used drugs for complete information about interactions with warfarin sodium or increased risks for bleeding. ( 7 ) 7.1 General Information Drugs may interact with warfarin sodium through pharmacodynamic or pharmacokinetic mechanisms. Pharmacodynamic mechanisms for drug interactions with warfarin sodium are synergism (impaired hemostasis, reduced clotting factor synthesis), competitive antagonism (vitamin K), and alteration of the physiologic control loop for vitamin K metabolism (hereditary resistance). Pharmacokinetic mechanisms for drug interactions with warfarin sodi', '[warfarin — drug_interactions] 7 DRUG INTERACTIONS Concomitant use of drugs that increase bleeding risk, antibiotics, antifungals, botanical (herbal) products, and inhibitors and inducers of CYP2C9, 1A2, or 3A4. ( 7 ) Consult labeling of all concurrently used drugs for complete information about interactions with warfarin sodium or increased risks for bleeding. ( 7 ) 7.1 General Information Drugs may interact with warfarin sodium through pharmacodynamic or pharmacokinetic mechanisms. Pharmacodynamic mechanisms for drug interactions with warfarin sodium are synergism (impaired hemostasis, reduced clotting factor synthesis), competitive antagonism (vitamin K), and alteration of the physiologic control loop for vitamin K metabolism (hereditary resistance). Pharmacokinetic mechanisms for drug interactions with warfarin sodi', '[warfarin — drug_interactions]  nefazodone, nelfinavir, nilotinib, oral contraceptives, posaconazole, ranitidine, ranolazine, ritonavir, saquinavir, telithromycin, tipranavir, voriconazole, zileuton armodafinil, amprenavir, aprepitant, bosentan, carbamazepine, efavirenz, etravirine, modafinil, nafcillin, phenytoin, pioglitazone, prednisone, rifampin, rufinamide 7.3 Drugs that Increase Bleeding Risk Examples of drugs known to increase the risk of bleeding are presented in Table 3 . Because bleeding risk is increased when these drugs are used concomitantly with warfarin, closely monitor patients receiving any such drug with warfarin. Table 3: Drugs that Can Increase the Risk of Bleeding Drug Class Specific Drugs Anticoagulants argatroban, dabigatran, bivalirudin, desirudin, heparin, lepirudin Antiplatelet Agents aspirin, ']","Drugs that interact with warfarin include antibiotics, antifungals, botanical (herbal) products, and inhibitors and inducers of CYP2C9, 1A2, or 3A4. Some specific examples mentioned are nefazodone, nelfinavir, nilotinib, oral contraceptives, posaconazole, ranitidine, ranolazine, ritonavir, saquinavir, telithromycin, tipranavir, voriconazole, zileuton, armodafinil, amprenavir, aprepitant, bosentan, carbamazepine, efavirenz, etravirine, modafinil, nafcillin, phenytoin, pioglitazone, prednisone, rifampin, and rufinamide. Additionally, anticoagulants and antiplatelet agents like aspirin can increase the risk of bleeding when used with warfarin. [warfarin — drug_interactions]","CYP2C9 inhibitors (e.g., amiodarone, fluconazole) and inducers (e.g., rifampin, carbamazepine).",1.0,0.99999999998,1.0
What is metformin prescribed for?,"[""[metformin — dosage_and_administration] sis of the patient's current regimen, effectiveness, and tolerability. The maximum recommended daily dose is 100 mg of sitagliptin and 2,000 mg of metformin hydrochloride (HCl). Do not split or divide ZITUVIMET tablets. The recommended starting dose in patients not currently treated with metformin is 50 mg sitagliptin and 500 mg metformin HCl twice daily, with gradual dose escalation recommended to reduce gastrointestinal side effects associated with metformin. The starting dose in patients already treated with metformin should provide sitagliptin dosed as 50 mg twice daily (100 mg total daily dose) and the dose of metformin already being taken. For patients taking metformin HCl 850 mg twice daily, the recommended starting dose of ZITUVIMET is 50 mg sitagliptin and 1,000 mg metformin HCl t"", ""[metformin — dosage_and_administration] sis of the patient's current regimen, effectiveness, and tolerability. The maximum recommended daily dose is 100 mg of sitagliptin and 2,000 mg of metformin hydrochloride (HCl). Do not split or divide ZITUVIMET tablets. The recommended starting dose in patients not currently treated with metformin is 50 mg sitagliptin and 500 mg metformin HCl twice daily, with gradual dose escalation recommended to reduce gastrointestinal side effects associated with metformin. The starting dose in patients already treated with metformin should provide sitagliptin dosed as 50 mg twice daily (100 mg total daily dose) and the dose of metformin already being taken. For patients taking metformin HCl 850 mg twice daily, the recommended starting dose of ZITUVIMET is 50 mg sitagliptin and 1,000 mg metformin HCl t"", '[metformin — adverse_reactions] herapy reported in ≥5% of patients and more commonly than in patients given placebo was nasopharyngitis. Metformin The most common (>5%) established adverse reactions due to initiation of metformin therapy are diarrhea, nausea/vomiting, flatulence, abdominal discomfort, indigestion, asthenia, and headache. Laboratory Tests Sitagliptin The incidence of laboratory adverse reactions was similar in patients treated with sitagliptin and metformin (7.6%) compared to patients treated with placebo and metformin (8.7%). In most but not all trials, a small increase in white blood cell count (approximately 200 cells/microL difference in WBC vs placebo; mean baseline WBC approximately 6,600 cells/microL) was observed due to a small increase in neutrophils. This change in laboratory parameters is not c', '[metformin — adverse_reactions] herapy reported in ≥5% of patients and more commonly than in patients given placebo was nasopharyngitis. Metformin The most common (>5%) established adverse reactions due to initiation of metformin therapy are diarrhea, nausea/vomiting, flatulence, abdominal discomfort, indigestion, asthenia, and headache. Laboratory Tests Sitagliptin The incidence of laboratory adverse reactions was similar in patients treated with sitagliptin and metformin (7.6%) compared to patients treated with placebo and metformin (8.7%). In most but not all trials, a small increase in white blood cell count (approximately 200 cells/microL difference in WBC vs placebo; mean baseline WBC approximately 6,600 cells/microL) was observed due to a small increase in neutrophils. This change in laboratory parameters is not c', '[metformin — adverse_reactions] ) was observed due to a small increase in neutrophils. This change in laboratory parameters is not considered to be clinically relevant. Metformin In controlled clinical trials of metformin of 29 weeks duration, a decrease to subnormal levels of previously normal serum vitamin B 12 levels, without clinical manifestations, was observed in approximately 7% of patients. Such decrease, possibly due to interference with B 12 absorption from the B 12 -intrinsic factor complex, is, however, very rarely associated with anemia and appears to be rapidly reversible with discontinuation of metformin or vitamin B 12 supplementation. 6.2 Postmarketing Experience Additional adverse reactions have been identified during postapproval use of ZITUVIMET, sitagliptin, or metformin. Because these reactions are ']",I don't know.,To improve glycemic control in adults with type 2 diabetes.,0.0,0.0,1.0
What should be monitored in patients taking warfarin?,"['[warfarin — drug_interactions] ot shown consistent effects of these agents on plasma concentrations of warfarin. Closely monitor INR when starting or stopping any antibiotic or antifungal in patients taking warfarin. 7.5 Botanical (Herbal) Products and Foods More frequent INR monitoring should be performed when starting or stopping botanicals. Few adequate, well-controlled studies evaluating the potential for metabolic and/or pharmacologic interactions between botanicals and warfarin sodium exist. Due to a lack of manufacturing standardization with botanical medicinal preparations, the amount of active ingredients may vary. This could further confound the ability to assess potential interactions and effects on anticoagulation. Some botanicals may cause bleeding events when taken alone (e.g., garlic and Ginkgo biloba) an', '[warfarin — drug_interactions] ot shown consistent effects of these agents on plasma concentrations of warfarin. Closely monitor INR when starting or stopping any antibiotic or antifungal in patients taking warfarin. 7.5 Botanical (Herbal) Products and Foods More frequent INR monitoring should be performed when starting or stopping botanicals. Few adequate, well-controlled studies evaluating the potential for metabolic and/or pharmacologic interactions between botanicals and warfarin sodium exist. Due to a lack of manufacturing standardization with botanical medicinal preparations, the amount of active ingredients may vary. This could further confound the ability to assess potential interactions and effects on anticoagulation. Some botanicals may cause bleeding events when taken alone (e.g., garlic and Ginkgo biloba) an', '[warfarin — dosage_and_administration] . 2.4 Monitoring to Achieve Optimal Anticoagulation Warfarin sodium tablets have a narrow therapeutic range (index), and their action may be affected by factors such as other drugs and dietary vitamin K. Therefore, anticoagulation must be carefully monitored during warfarin sodium tablets therapy. Determine the INR daily after the administration of the initial dose until INR results stabilize in the therapeutic range. After stabilization, maintain dosing within the therapeutic range by performing periodic INRs. The frequency of performing INR should be based on the clinical situation but generally acceptable intervals for INR determinations are 1 to 4 weeks. Perform additional INR tests when other warfarin products are interchanged with warfarin sodium tablets, as well as whenever other me', '[warfarin — dosage_and_administration] . 2.4 Monitoring to Achieve Optimal Anticoagulation Warfarin sodium tablets have a narrow therapeutic range (index), and their action may be affected by factors such as other drugs and dietary vitamin K. Therefore, anticoagulation must be carefully monitored during warfarin sodium tablets therapy. Determine the INR daily after the administration of the initial dose until INR results stabilize in the therapeutic range. After stabilization, maintain dosing within the therapeutic range by performing periodic INRs. The frequency of performing INR should be based on the clinical situation but generally acceptable intervals for INR determinations are 1 to 4 weeks. Perform additional INR tests when other warfarin products are interchanged with warfarin sodium tablets, as well as whenever other me', '[warfarin — dosage_and_administration]  other warfarin products are interchanged with warfarin sodium tablets, as well as whenever other medications are initiated, discontinued, or taken irregularly. Heparin, a common concomitant drug, increases the INR [see Dosage and Administration ( 2.8 ) and Drug Interactions ( 7 )] . Determinations of whole blood clotting and bleeding times are not effective measures for monitoring of warfarin sodium tablets therapy. 2.5 Renal Impairment No dosage adjustment is necessary for patients with renal failure. Monitor INR more frequently in patients with compromised renal function to maintain INR within the therapeutic range [see Warnings and Precautions ( 5.4 ) and Use in Specific Populations ( 8.6 )]. 2.6 Missed Dose The anticoagulant effect of warfarin sodium tablets persists beyond 24 hours. ']","In patients taking warfarin, the International Normalized Ratio (INR) should be closely monitored. This is important when starting or stopping any antibiotics, antifungals, botanicals, or when other medications are initiated or discontinued, as these factors can affect anticoagulation [warfarin — drug_interactions], [warfarin — dosage_and_administration].",INR / prothrombin time.,1.0,0.99999999998,0.0
